{"decision_vector_id":"sha256:d461b0691438a309d947aa07128ab35e6fbe2019968a249b01d658b751fe4b42","entries":[{"bundle_id":"sha256:19bfefeafb3f47b4516ed3433d744e44e22ae70d474c9843cb1b0f943fe0f69d","probabilities_ppm":[850000,50000,40000,30000,30000]},{"bundle_id":"sha256:4786bc02c668521176416d5ba9d30a820beca0a448fa29b411ddb0cd7068dfe5","candidate":"search","probabilities_ppm":[700000,200000,100000]},{"bundle_id":"sha256:523471e525844f0fad92059ff66f930798deffda566565604c6ec26ff72a516a","probabilities_ppm":[800000,150000,50000]},{"bundle_id":"sha256:730a878335eab5e52cd0ff651c3cd198f9f6890f380a67cd4fd085c735438627","probabilities_ppm":[650000,150000,100000,50000,50000]},{"bundle_id":"sha256:97ebcb68c10d886998143050e0d6c59e9e83b6aec372211ca5004fecff6638e2","probabilities_ppm":[900000,100000,700000,50000]},{"bundle_id":"sha256:9f552c71c501d729e3f02116d2479697a58295867803888535a60778b4048f14","probabilities_ppm":[700000,100000,100000,50000,50000]}],"observation_id":"c03-set-agreement","producer":{"kind":"PRERECORDED","source":"ff-s15-c0-runtime-01 fixtures"},"schema":"S15_DECISION_VECTOR_V1"}